{
  "schema_version": "1.0.0",
  "prompt_pack_id": "kernberg_iteration_review_v1",
  "meta": {
    "run_timestamp_utc": "2026-04-07T12:00:00Z",
    "source_file": "demo_session.json",
    "source_label": "demo_session",
    "modules_executed": [
      "tfp.v1"
    ],
    "module_versions": {
      "tfp.v1": "0.5.6"
    },
    "calibration_dict_pack": null,
    "disclaimer_footer": "This output is a computational artifact from the Hesperia analysis engine. It is not medical advice, diagnosis, or treatment. Clinical decisions require a qualified professional and must not rely on this tool alone."
  },
  "iteration": {
    "iteration_id": "iter_0",
    "order": 0,
    "t_start_ms": 0,
    "t_end_ms": 5000,
    "wall_clock_iso": "2026-04-07T12:00:01Z"
  },
  "parameters": {
    "areas": {
      "A1": 0.7
    },
    "families": {
      "F01": 0.3
    },
    "modules": {
      "tfp.v1": {
        "tfp_profile": {
          "dominant": "test",
          "confidence": 0.5
        }
      }
    }
  },
  "sentences": [
    {
      "id": "s0",
      "text": "I feel stuck when the topic shifts.",
      "order": 0
    }
  ],
  "audit": {
    "iteration": {},
    "by_sentence": {}
  },
  "messages": [
    {
      "role": "system",
      "content": "You are a senior psychotherapy researcher and clinician with deep familiarity with Transference-Focused Psychotherapy (TFP) and Otto Kernberg’s descriptive and psychodynamic tradition.\n\nYour task is to read ONLY the structured engine output and client text supplied in the user message. You must:\n- Confirm, deny, or nuance how well the supplied quantitative/structured signals align with common TFP constructs (e.g., areas, families, profile descriptors) as descriptive hypotheses about this single iteration.\n- Stay interpretive of the artifact — not of a real person you have not examined.\n- Do NOT provide treatment plans, medication advice, crisis instructions, or directives to the patient or therapist.\n- Do NOT infer identity, diagnosis, or prognosis beyond what the text explicitly supports.\n- If data are missing or contradictory, say so plainly.\n\nOutput format: concise clinical-research prose (paragraphs or short bullets). Mark uncertainty where appropriate.\n"
    },
    {
      "role": "user",
      "content": "\nprompt_pack: kernberg_iteration_review_v1\n\n## Iteration segment (full JSON)\n```json\n{\n  \"schema_version\": \"1.0.0\",\n  \"prompt_pack_id\": \"kernberg_iteration_review_v1\",\n  \"meta\": {\n    \"run_timestamp_utc\": \"2026-04-07T12:00:00Z\",\n    \"source_file\": \"demo_session.json\",\n    \"source_label\": \"demo_session\",\n    \"modules_executed\": [\n      \"tfp.v1\"\n    ],\n    \"module_versions\": {\n      \"tfp.v1\": \"0.5.6\"\n    },\n    \"calibration_dict_pack\": null,\n    \"disclaimer_footer\": \"This output is a computational artifact from the Hesperia analysis engine. It is not medical advice, diagnosis, or treatment. Clinical decisions require a qualified professional and must not rely on this tool alone.\"\n  },\n  \"iteration\": {\n    \"iteration_id\": \"iter_0\",\n    \"order\": 0,\n    \"t_start_ms\": 0,\n    \"t_end_ms\": 5000,\n    \"wall_clock_iso\": \"2026-04-07T12:00:01Z\"\n  },\n  \"parameters\": {\n    \"areas\": {\n      \"A1\": 0.7\n    },\n    \"families\": {\n      \"F01\": 0.3\n    },\n    \"modules\": {\n      \"tfp.v1\": {\n        \"tfp_profile\": {\n          \"dominant\": \"test\",\n          \"confidence\": 0.5\n        }\n      }\n    }\n  },\n  \"sentences\": [\n    {\n      \"id\": \"s0\",\n      \"text\": \"I feel stuck when the topic shifts.\",\n      \"order\": 0\n    }\n  ],\n  \"audit\": {\n    \"iteration\": {},\n    \"by_sentence\": {}\n  }\n}\n```\n\n## Client text (JSON string excerpt; same as sentences joined in tooling)\n\"I feel stuck when the topic shifts.\"\n\n## Parameter summary (tabular)\n- areas: <structured>\n- families: <structured>\n- modules: <structured>\n\n## Instructions\nGiven ONLY the JSON and text above, provide a Kernberg/TFP-aligned interpretive review for THIS iteration: confirm / deny / interpret the consistency of the structured outputs with relevant TFP constructs. Note limitations of computational scoring. Do not give treatment advice."
    }
  ]
}
